{
  "$schema": "https://json-schema.org/draft/2020-12/schema",
  "title": "SOC Normalized Alert v1",
  "type": "object",
  "additionalProperties": false,
  "required": [
    "schema_version",
    "event_id",
    "occurred_at",
    "source",
    "rule_id",
    "severity",
    "title",
    "evidence"
  ],
  "properties": {
    "schema_version": {
      "const": "1.0"
    },
    "event_id": {
      "type": "string",
      "minLength": 1,
      "maxLength": 128,
      "pattern": "^[A-Za-z0-9._:-]+$"
    },
    "occurred_at": {
      "type": "string",
      "format": "date-time"
    },
    "source": {
      "type": "object",
      "additionalProperties": false,
      "required": [
        "system",
        "record_id"
      ],
      "properties": {
        "system": {
          "enum": [
            "windows",
            "aws_cloudtrail",
            "authentication",
            "other"
          ]
        },
        "record_id": {
          "type": "string",
          "minLength": 1,
          "maxLength": 256
        }
      }
    },
    "rule_id": {
      "type": "string",
      "minLength": 1,
      "maxLength": 128
    },
    "severity": {
      "enum": [
        "informational",
        "low",
        "medium",
        "high",
        "critical"
      ]
    },
    "title": {
      "type": "string",
      "minLength": 1,
      "maxLength": 200
    },
    "actor": {
      "type": "string",
      "maxLength": 256
    },
    "asset": {
      "type": "string",
      "maxLength": 256
    },
    "attack_techniques": {
      "type": "array",
      "uniqueItems": true,
      "items": {
        "type": "string",
        "pattern": "^T[0-9]{4}(\\.[0-9]{3})?$"
      }
    },
    "evidence": {
      "type": "array",
      "minItems": 1,
      "maxItems": 30,
      "items": {
        "type": "object",
        "additionalProperties": false,
        "required": [
          "reference",
          "description"
        ],
        "properties": {
          "reference": {
            "type": "string",
            "minLength": 1,
            "maxLength": 256
          },
          "description": {
            "type": "string",
            "minLength": 1,
            "maxLength": 400
          }
        }
      }
    }
  }
}
